{
  "schema_version": "1.0.0",
  "id": "platform-recovery-worker-lifecycle-local-only",
  "capability": "worker_lifecycle",
  "severity": "warning",
  "status": "open",
  "action_type": "restart_local_worker",
  "title": "Worker lifecycle is running in local-only fallback.",
  "description": "The platform worker lifecycle is unavailable. Keep local browsing available and offer a controlled worker restart when the platform adapter is ready.",
  "source": {
    "health_status": "degraded",
    "health_ref": "crp://default/product-health/platform"
  },
  "evidence": {
    "degraded_capabilities": [
      "worker_lifecycle"
    ],
    "missing_capabilities": [],
    "os_path_leaks": []
  },
  "execution": {
    "auto_execute": false,
    "requires_user_confirmation": true,
    "job_id": null
  },
  "user_decision": null,
  "resolution": null,
  "created_at": "2026-07-01T02:00:00+08:00",
  "updated_at": "2026-07-01T02:00:00+08:00"
}
